NCT Number,Study Title,Study URL,Acronym,Study Status,Brief Summary,Study Results,Conditions,Interventions,Primary Outcome Measures,Secondary Outcome Measures,Other Outcome Measures,Sponsor,Collaborators,Sex,Age,Phases,Enrollment,Funder Type,Study Type,Study Design,Other IDs,Start Date,Primary Completion Date,Completion Date,First Posted,Results First Posted,Last Update Posted,Locations,Study Documents,,,,
NCT03732820,Study on Olaparib Plus Abiraterone as First-line Therapy in Men With Metastatic Castration-resistant Prostate Cancer,https://clinicaltrials.gov/study/NCT03732820,,ACTIVE_NOT_RECRUITING,The purpose of this study is to evaluate the efficacy and safety (including evaluating side effects) of combination of olaparib and abiraterone versus placebo and abiraterone in patients with metastatic castration-resistant prostate cancer (mCRPC) who have received no prior cytotoxic chemotherapy or new hormonal agents (NHAs) at metastatic castration-resistant prostate cancer (mCRPC) stage.,YES,Metastatic Castration-resistant Prostate Cancer,DRUG: olaparib|DRUG: abiraterone acetate,"Number of Participants With Radiological Progression Free Survival (rPFS) Event by Investigator Assessment, An rPFS event is defined as progression determined by Response Evaluation Criteria in Solid Tumours version 1.1 \[RECIST 1.1\] and/or Prostate Cancer Working Group 3 \[PCWG-3\] or death (by any cause in the absence of progression), regardless of whether the patient withdraws from randomised therapy or receives another anticancer therapy prior to progression.

Per RECIST v1.1, progression is defined as the sum of TLs has a 20% and absolute ≥ 5mm increase from nadir, and/or unequivocal progression in any non target lesions, and/or any new lesion identified.

Per PCWG3, progression on a bone scan is defined as 2 or more new lesions observed from the first visit after baseline compared to baseline, or from all other visits compared to first visit after baseline. A confirmatory scan is required., Assessed from date of randomisation to data cut off (DCO1): 30Jul2021 (Approx. 2 years 9 months)","Number of Participants With Overall Survival (OS) Event, An OS event is defined as death by any cause, regardless of whether the patient withdraws from randomised therapy or receives another anticancer therapy., Assessed from date of randomisation to data cut off (DCO3): 12Oct2022 (Approx. 3 years 11 months). DCO3 is the final data cut-off for the OS analysis and therefore no further updates will be made.|Number of Participants With Time to First Subsequent Anticancer Therapy or Death (TFST) Event, A TFST (excluding radiotherapy) event is defined as the start of the first subsequent anticancer therapy after discontinuation of randomised treatment or death from any cause., Assessed from date of randomisation to data cut off (DCO3): 12Oct2022 (Approx. 3 years 11 months)|Number of Participants With Time to Pain Progression (TTPP) Event, A TTPP event is defined as pain progression based on the Brief Pain Inventory-Short Form (BPI-SF) Item 3 (range 0-10, a higher score indicates worse pain) and opiate analgesic use (Analgesic quantification algorithm \[AQA\] score, range 0-7, a higher score indicates increased opioid use). For patients who are asymptomatic at baseline (average worst pain score of 0 and not taking opioids): A ≥2 point change from baseline in average (4-7 days) worst pain score observed at 2 consecutive visits or initiation of opioid use; For patients who are symptomatic at baseline (average worst pain score \>0 and/or receiving opioids): A ≥2 point change from baseline in average (4-7 days) worst pain score observed at 2 consecutive visits and an average worst pain score ≥4, and no decrease in average opioid use (≥1-point decrease in AQA score from a starting value of ≥2), or increase in opioid use (≥1-point increase, or ≥2-point increase if the starting value is 0) at 2 consecutive follow-up visits., Assessed from date of randomisation to data cut off (DCO3): 12Oct2022 (Approx. 3 years 11 months)|Number of Participants With Opiate Use, An event for opiate use is defined as the first opiate use for cancer related pain., Assessed from date of randomisation to data cut off (DCO3): 12Oct2022 (Approx. 3 years 11 months)|Number of Participants With First Symptomatic Skeletal Related Event (SSRE), An SSRE event is defined as the first sympomatic skeletal-related event defined by

* Use of radiation therapy to prevent or relieve skeletal symptoms.
* Occurrence of new symptomatic pathological bone fractures (vertebral or non-vertebral)., Assessed from date of randomisation to data cut off (DCO3): 12Oct2022 (Approx. 3 years 11 months)|Number of Participants With Second Progression or Death (PFS2) Event, An event for PFS2 is defined as the second progression on next-line anticancer therapy or death, whichever occurs earlier., Assessed from date of randomisation to data cut off (DCO3): 12Oct2022 (Approx. 3 years 11 months)|Brief Pain Inventory-Short Form (BPI-SF), The BPI-SF is a validated, 15-item domain-specific instrument designed to assess the severity of pain and the impact/interference of pain on daily functions. BPI-SF worst pain, pain severity and pain interference score changes can be a minimum of -10 and a maximum of 10. A negative change from baseline value indicates improvement., Assessed from date of randomisation to data cut off (DCO3): 12Oct2022 (Approx. 3 years 11 months)|Functional Assessment of Cancer Therapy- Prostate Cancer (FACT-P), Functional Assessment of Cancer Therapy-Prostate Cancer (FACT-P) total score and Functional Assessment of Cancer Therapy-General (FACT-G) total score.

Total FACT-P score is the sum of Physical Well-being (PWB), Social Well-being (SWB), Emotional Well-being (EWB), Functional Well-being (FWB) and Prostate cancer subscale (PCS). FACT-P total score change from baseline values can be a minimum of -156 and a maximum of 156. A positive value indicates improvement.

FACT-G total score is the sum of PWB, SWB, EWB and FWB. FACT-G Total score change from baseline values can be a minimum of -108 and a maximum of 108. A positive value indicates improvement., Assessed from date of randomisation to data cut off (DCO3): 12Oct2022 (Approx. 3 years 11 months)",,AstraZeneca,Merck Sharp & Dohme LLC,MALE,"ADULT, OLDER_ADULT",PHASE3,895,INDUSTRY,INTERVENTIONAL,"Allocation: RANDOMIZED|Intervention Model: PARALLEL|Masking: QUADRUPLE (PARTICIPANT, CARE_PROVIDER, INVESTIGATOR, OUTCOMES_ASSESSOR)|Primary Purpose: TREATMENT",D081SC00001|2018-002011-10,10/31/2018,7/30/2021,11/4/2024,11/7/2018,6/15/2023,7/30/2024,"Research Site, Birmingham, Alabama, 35209, United States|Research Site, Anchorage, Alaska, 99503, United States|Research Site, Tucson, Arizona, 85704, United States|Research Site, Tucson, Arizona, 85741, United States|Research Site, Clovis, California, 93611, United States|Research Site, Los Angeles, California, 90027, United States|Research Site, Los Angeles, California, 90073, United States|Research Site, Sacramento, California, 95817, United States|Research Site, San Diego, California, 92123, United States|Research Site, Denver, Colorado, 80211, United States|Research Site, Lisle, Illinois, 60532, United States|Research Site, Jeffersonville, Indiana, 47130, United States|Research Site, New Orleans, Louisiana, 70112, United States|Research Site, Detroit, Michigan, 48202, United States|Research Site, Grand Rapids, Michigan, 49503, United States|Research Site, Saint Louis, Missouri, 63106, United States|Research Site, Bozeman, Montana, 59715, United States|Research Site, Omaha, Nebraska, 68130, United States|Research Site, Paramus, New Jersey, 07652, United States|Research Site, Brooklyn, New York, 11220, United States|Research Site, New Hyde Park, New York, 11042, United States|Research Site, Rochester, New York, 14642, United States|Research Site, Syracuse, New York, 13210, United States|Research Site, Durham, North Carolina, 27710, United States|Research Site, Philadelphia, Pennsylvania, 19111, United States|Research Site, Charleston, South Carolina, 29425, United States|Research Site, Myrtle Beach, South Carolina, 29572, United States|Research Site, Milwaukee, Wisconsin, 53226, United States|Research Site, Box Hill, 3128, Australia|Research Site, Darlinghurst, 2010, Australia|Research Site, Greenslopes, 4120, Australia|Research Site, Herston, 4029, Australia|Research Site, Kingswood, 2747, Australia|Research Site, Kurralta Park, 5037, Australia|Research Site, St Albans, 3021, Australia|Research Site, Waratah, 2298, Australia|Research Site, Gent, 9000, Belgium|Research Site, Belo Horizonte, 30110-022, Brazil|Research Site, Curitiba, 80810-050, Brazil|Research Site, Fortaleza, 60336-232, Brazil|Research Site, Porto Alegre, 91350-200, Brazil|Research Site, Rio de Janeiro, 22793-080, Brazil|Research Site, Sao Paulo, 01221-020, Brazil|Research Site, Sao Paulo, 04266-010, Brazil|Research Site, São José do Rio Preto, 15090-000, Brazil|Research Site, Calgary, Alberta, T2V 1P9, Canada|Research Site, Edmonton, Alberta, T6G 1Z2, Canada|Research Site, Kelowna, British Columbia, V1Y 5L3, Canada|Research Site, Halifax, Nova Scotia, B3H 1V7, Canada|Research Site, London, Ontario, N6A 5W9, Canada|Research Site, Toronto, Ontario, M4N 3M5, Canada|Research Site, Toronto, Ontario, M5G 2M9, Canada|Research Site, Greenfield Park, Quebec, J4V 2H1, Canada|Research Site, Montreal, Quebec, H2X 3E4, Canada|Research Site, Montreal, Quebec, H3T 1E2, Canada|Research Site, Santiago, 7500787, Chile|Research Site, Santiago, 7520349, Chile|Research Site, Temuco, 4781156, Chile|Research Site, Viña del Mar, 2540488, Chile|Research Site, Brno, 656 53, Czechia|Research Site, Praha 5, 150 06, Czechia|Research Site, Praha, 120 00, Czechia|Research Site, Praha, 140 59, Czechia|Research Site, Angers Cedex 01, 49033, France|Research Site, BESANCON Cedex, 25030, France|Research Site, Caen Cedex 05, 14076, France|Research Site, Pierre Benite, 69495, France|Research Site, Quimper Cedex, 29107, France|Research Site, Vandoeuvre les Nancy, 54519, France|Research Site, Bergisch Gladbach, 51465, Germany|Research Site, Bremen, 28277, Germany|Research Site, Duisburg, 47169, Germany|Research Site, Freiburg im Breisgau, 79106, Germany|Research Site, Heinsberg, 52525, Germany|Research Site, Köln, 50968, Germany|Research Site, Mettmann, 40822, Germany|Research Site, Nürnberg, 90419, Germany|Research Site, Nürtingen, 72622, Germany|Research Site, Ulm, 89081, Germany|Research Site, Milano, 20133, Italy|Research Site, Milano, 20141, Italy|Research Site, Napoli, 80131, Italy|Research Site, Orbassano, 10043, Italy|Research Site, Pavia, 27100, Italy|Research Site, Bunkyo-ku, 113-8431, Japan|Research Site, Hirakata-shi, 573-1191, Japan|Research Site, Kanazawa-shi, 920-8641, Japan|Research Site, Kashihara-shi, 634-8522, Japan|Research Site, Kawagoe-shi, 350-8550, Japan|Research Site, Kita-gun, 761-0793, Japan|Research Site, Kyoto-shi, 606-8507, Japan|Research Site, Maebashi-shi, 371-8811, Japan|Research Site, Miyazaki-city, 889-1692, Japan|Research Site, Nagoya-shi, 466-8560, Japan|Research Site, Osaka-shi, 541-8567, Japan|Research Site, Osaka-shi, 545-8586, Japan|Research Site, Osakasayama-shi, 589-8511, Japan|Research Site, Sagamihara-shi, 252-0375, Japan|Research Site, Sakura-shi, 285-8741, Japan|Research Site, Shinjuku-ku, 160-8582, Japan|Research Site, Toon-shi, 791-0295, Japan|Research Site, Yokohama-shi, 232-0024, Japan|Research Site, Daegu, 41404, Korea, Republic of|Research Site, Goyang-si, 10408, Korea, Republic of|Research Site, Seoul, 03080, Korea, Republic of|Research Site, Seoul, 03722, Korea, Republic of|Research Site, Seoul, 05505, Korea, Republic of|Research Site, Seoul, 06591, Korea, Republic of|Research Site, Hilversum, 1213 XZ, Netherlands|Research Site, Nijmegen, 6525 GA, Netherlands|Research Site, Tilburg, 5042 AD, Netherlands|Research Site, Bratislava, 851 05, Slovakia|Research Site, Presov, 08001, Slovakia|Research Site, Sala, 92701, Slovakia|Research Site, Trenčín, 911 01, Slovakia|Research Site, Barcelona, 08036, Spain|Research Site, Gerona, 17007, Spain|Research Site, Madrid, 08035, Spain|Research Site, Madrid, 28041, Spain|Research Site, Malaga, 29010, Spain|Research Site, Sevilla, 41009, Spain|Research Site, Adana, 01060, Turkey|Research Site, Ankara, 06590, Turkey|Research Site, Ankara, 06800, Turkey|Research Site, Istanbul, 34030, Turkey|Research Site, Izmir, 35360, Turkey|Research Site, Karsiyaka, 35575, Turkey|Research Site, Guildford, GU2 7WG, United Kingdom|Research Site, Manchester, M20 4BX, United Kingdom|Research Site, Sheffield, S10 2SJ, United Kingdom|Research Site, Southampton, SO16 6YD, United Kingdom|Research Site, Swansea, SA2 8QA, United Kingdom","Study Protocol, https://cdn.clinicaltrials.gov/large-docs/20/NCT03732820/Prot_000.pdf","Statistical Analysis Plan, https://cdn.clinicaltrials.gov/large-docs/20/NCT03732820/SAP_001.pdf",,,
NCT04408924,Abemaciclib (LY2835219) in Men With Heavily Treated Metastatic Castration-Resistant Prostate Cancer,https://clinicaltrials.gov/study/NCT04408924,CYCLONE 1,COMPLETED,The study will evaluate how safe and effective abemaciclib is when given to participants whose metastatic prostate cancer progresses after they had received several previous treatments.,YES,Metastatic Castration-Resistant Prostate Cancer,DRUG: Abemaciclib,"Percentage of Participants With Confirmed Objective Response (Objective Response Rate [ORR]), ORR is defined as the percentage of participants with a confirmed complete response (CR) or confirmed partial response (PR) in soft tissue per response evaluation criteria in solid tumors (RECIST) version 1.1 and do not have concurrent bone progression per Prostate Cancer Clinical Trials Working Group 3 (PCWG3), as assessed by the investigator.

ORR = (participants with confirmed CR and no bone progression) + (participants with confirmed PR and no bone progression) x 100 / all treated participants., From Date of First Dose until Objective Progression (Up To 12.8 Months)","Radiographic Progression-Free Survival (rPFS), The rPFS time is measured from the date of first dose to the earliest date of investigator-assessed radiographic progression per RECIST 1.1 for soft tissue and PCWG3 criteria for bone, or death from any cause, whichever occurred first. Participants who have neither progressed nor died will be censored at the day of their last radiographic tumor assessment (if available) or date of first dose if no post initiation (i.e., postbaseline) radiographic assessment is available., From Date of First Dose until Objective Progression or Death from Any Cause (Up To 12.8 Months)|Overall Survival (OS), OS time is measured from the date of first dose to the date of death from any cause. If the participant was alive or lost to follow-up at the time of data analysis, OS data were censored on the last date the participant was known to be alive., From Date of First Dose until Date of Death from Any Cause (Up To 28 Months)|Duration of Response (DoR), DoR is measured only for confirmed responders (participants with a confirmed soft tissue best overall response of CR or PR per RECIST 1.1 no concurrent bone progression per PCWG3). It is measured from the date of first evidence of soft tissue CR or PR to the earliest date of investigator-assessed radiographic progression or death from any cause, whichever is earlier., CR or PR to Disease Progression or Death Due to Any Cause (Up to 12 Months)|Percentage of Participants Achieving CR, PR or Stable Disease (SD) (Disease Control Rate [DCR]), The DCR is defined as the percentage of participants with confirmed soft tissue best overall response of CR, PR, or stable disease (SD) per RECIST 1.1, and do not have concurrent bone disease progression per PCWG3., From Date of First Dose until Measured Progressive Disease or Death Due to Any Cause (Up To 12.8 Months)|Time to Prostate-Specific Antigen (PSA) Progression, Time to PSA progression is defined as the time from the date of treatment initiation to the date of first observation of PSA progression. The PSA progression is defined as a greater than or equal to (\>=) 25 percentage (%) increase and an absolute increase of \>=2 nanogram/milliliter (ng/mL) above the nadir (or baseline value if baseline is the smallest on study), which is confirmed by a second value obtained 3 or more weeks later., From Date of First Dose until Confirmed PSA Progression (Up To 12.8 Months)|Percentage of Participants Who Achieved Prostate-Specific Antigen (PSA) Response (PSA Response Rate), The PSA response rate is defined as the percentage of participants with a reduction in PSA level ≥50% from baseline, confirmed with a second assessment conducted at least 3 weeks later., From Date of First Dose until Confirmed PSA Progression (Up To 12.8 Months)|Time to Symptomatic Progression, Time to symptomatic progression is defined as the time from first dose to any of the following (whichever occurred earlier): 1) symptomatic skeletal event, defined as symptomatic fracture, surgery, or radiation to bone, or spinal cord compression; 2) pain progression or worsening of disease-related symptoms requiring initiation of a new systemic anticancer therapy; and 3) development of clinically significant symptoms due to locoregional tumor progression requiring surgical intervention or radiation therapy. For participants who were not known to have symptomatic progression at the time of data analysis, data were censored on the last date at which no symptomatic progression was indicated., From Date of First Dose until Symptomatic Progression (Up to 12.8 Months)|Pharmacokinetics (PK): Maximum Plasma Concentration at Steady State (Cmax,ss) of Abemaciclib, PK: Cmax,ss of abemaciclib is reported. The cycle length was 28 days., Cycle (C) 1 Day (D) 1: Post dose; C1 D15, C2D1, C2D15, C3D1: Pre dose|PK: Minimum/Trough Concentration at Steady State (Cmin,ss) of Abemaciclib, PK: Cmin,ss of abemaciclib is reported., C1 D1: Post dose; C1 D15, C2D1, C2D15, C3D1: Pre dose|PK: Maximum Plasma Concentration at Steady State (Cmax,ss) of Abemaciclib Metabolites (Total Active Species), PK: Cmax,ss of abemaciclib metabolites (Total Active Species) is reported., C1 D1: Post dose; C1 D15, C2D1, C2D15, C3D1: Pre dose|PK: Minimum/Trough Concentration at Steady State (Cmin,ss) of Abemaciclib Metabolites (Total Active Species), PK: Cmin,ss of abemaciclib metabolites (Total Active Species) is reported., C1 D1: Post dose; C1 D15, C2D1, C2D15, C3D1: Pre dose|Percentage of Participants With Expression of Ki-67 Proliferation Marker by Immunohistochemistry (IHC), Percentage of participants with expression of Ki-67 proliferation marker at baseline by immunohistochemistry.

Baseline expression of the Ki-67 proliferation marker was evaluated by IHC utilizing a 20% or higher score to define high Ki-67 expression. The percentage of Ki-67 positive cells was defined by the number of non-apoptotic tumor cells with unequivocal brown nuclear staining (intensities ≥1 using a 0-3 scale) over the total number of non-apoptotic tumor cells. Unit of Measure is percentage of participants with low or high baseline Ki-67 expression., Baseline",,Eli Lilly and Company,,MALE,"ADULT, OLDER_ADULT",PHASE2,44,INDUSTRY,INTERVENTIONAL,Allocation: NA|Intervention Model: SINGLE_GROUP|Masking: NONE|Primary Purpose: TREATMENT,17583|I3Y-MC-JPCY|2020-000290-24,1/20/2021,4/27/2022,6/2/2023,5/29/2020,5/24/2023,6/25/2024,"University of Utah - Huntsman Cancer Institute, Salt Lake City, Utah, 84112, United States|Seattle Cancer Care Alliance, Seattle, Washington, 98109, United States|Centre Leon Berard, Lyon Cedex 08, 69373, France|Institut Paoli-Calmettes, Marseille, 13273, France|Hopital Europeen Georges Pompidou, Paris, 75015, France|Institut Claudius Regaud, Toulouse cedex 9, 31059, France|Gustave Roussy, Villejuif Cedex, 94805, France|Institut Catala d'Oncologia, L'Hospitalet de Llobregat, Barcelona, 08907, Spain|Corporacion Sanitaria Parc Tauli, Sabadell, Barcelona, 08208, Spain|Hospital de la Santa Creu i Sant Pau, Barcelona, 08025, Spain|Hospital Universitari Vall d'Hebron, Barcelona, 08035, Spain|Hospital General Universitario Gregorio Maranon, Madrid, 28007, Spain|Hospital Universitario Ramon y Cajal, Madrid, 28034, Spain|Hospital Universitario 12 de Octubre, Madrid, 28041, Spain","Study Protocol, https://cdn.clinicaltrials.gov/large-docs/24/NCT04408924/Prot_000.pdf","Statistical Analysis Plan, https://cdn.clinicaltrials.gov/large-docs/24/NCT04408924/SAP_001.pdf",,,
