NCT Number,Study Title,Study URL,Acronym,Study Status,Brief Summary,Study Results,Conditions,Interventions,Primary Outcome Measures,Secondary Outcome Measures,Other Outcome Measures,Sponsor,Collaborators,Sex,Age,Phases,Enrollment,Funder Type,Study Type,Study Design,Other IDs,Start Date,Primary Completion Date,Completion Date,First Posted,Results First Posted,Last Update Posted,Locations,Study Documents,,,,
NCT03343093,Restore: Improving Sexual Outcomes of Gay and Bisexual Prostate Cancer Survivors,https://clinicaltrials.gov/study/NCT03343093,,COMPLETED,Development and evaluation of an online intervention addressing sexual functioning in gay and bisexual men (GBM) after prostate cancer treatment.,YES,Prostatic Neoplasm,BEHAVIORAL: Restore Rehabilitation Program|BEHAVIORAL: Control,"Urinary Function Scores, The Urinary Function domain of the Expanded Prostate Cancer Index Composite (EPIC-50) scale was used to assess the frequency of urinary symptoms. Scores range from 0 to 100, with higher scores indicating less frequency of urinary symptoms., 24 months|Sexual Functioning Scores, The Sexual Functioning domain of the Expanded Prostate Cancer Index Composite (EPIC-50) scale was used to assess the frequency of sexual functioning symptoms. Scores range from 0 to 100, with higher scores indicating less frequency of sexual functioning symptoms., 24 months|Intervention Acceptability, Acceptability was measured by how much intervention group participants would recommend the intervention to a friend (if he had prostate cancer). This single Likert-type item has five response options from 1=strongly agree to 5= strongly disagree. Acceptability will be measured by adding those who answered 1=strongly agree or 2=agree on this item., 3-month follow-up|Intervention Feasibility, Feasibility will be measured by monitoring the number of intervention participants who could access the intervention webpage at least once within the first three months of the study., 3-month follow-up",,,University of Minnesota,National Cancer Institute (NCI),MALE,"ADULT, OLDER_ADULT",NA,403,OTHER,INTERVENTIONAL,Allocation: RANDOMIZED|Intervention Model: PARALLEL|Masking: SINGLE (PARTICIPANT)|Primary Purpose: SUPPORTIVE_CARE,SPH-2018-26507|1R01CA218657-01,1/1/2019,9/15/2021,6/20/2023,11/17/2017,4/2/2024,4/2/2024,"University of Minnesota Twin Cities Campus, Minneapolis, Minnesota, 55454, United States",https://cdn.clinicaltrials.gov/large-docs/93/NCT03343093/Prot_000.pdf,,,,
NCT05249127,64Cu-SAR-bisPSMA for Identification of Participants With Recurrence of Prostate Cancer (COBRA),https://clinicaltrials.gov/study/NCT05249127,COBRA,COMPLETED,The aim of this study is to determine the safety and efficacy of 64Cu-SAR-bisPSMA and determine the ability of 64Cu-SAR-bisPSMA Positron emission tomography (PET)/computed tomography (CT) to correctly detect the recurrence of prostate cancer in participants with biochemical recurrence of prostate cancer following definitive therapy.,YES,Biochemical Recurrence of Malignant Neoplasm of Prostate,DRUG: 64Cu-SAR-bisPSMA,"Safety and Tolerability, Incidence and severity of Treatment-Emergent Adverse Events (TEAE) and Serious Adverse Events. Adverse Events were assessed by CTCAE version 5.0, up to 7 days post injection|Participant-level Correct Detection Rate (CDR)- Day 0, The percentage of TP participants on the Day 0 scan out of all participants with a Day 0 scan., Day 0 (1- 4 hours) post injection|Participant-level CDR- Day 1, The percentage of TP participants on the Day 1 scan out of all participants with a Day 1 scan., Day 1 (24+/-6 Hours) post injection|Region-level Positive Predictive Value (PPV)- Day 0, The percentage of TP regions on the Day 0 scan out of all positive regions on the Day 0 scan., Day 0 (1- 4 hours)|Region-level PPV- Day 1, The percentage of TP regions on the Day 1 scan out of all positive regions on the Day 1 scan., Day 1 (24 +/- 6 hours)","Biodistribution of 64Cu-SAR-bisPSMA- SUVmean, The mean Standardized Uptake Value (SUVmean) in lesions, visceral soft tissue and bone., Day 0 (1 -4 hours) and Day 1 (24 +/- 6 hours) post injection|Biodistribution of 64Cu-SAR-bisPSMA- SUVmax, SUVmax in lesions, visceral soft tissue and bone, Day 0 (1-4 hours) and Day 1 (24 +/- 6 hours)|Biodistribution of 64Cu-SAR-bisPSMA- SUVr, Lesion to Background ratio. SUVmax of the lesion divided by the SUVmean of gluteus background, Day 0 (1-4 hours) and Day 1 (24 +/- 6 hours)|Participant-level PPV, Percentage of TP participants on the Day 0 or Day 1 scan out of all participants with a positive Day 0 or Day 1 scan., Day 0 (1-4 hours) and Day 1 (24 +/- 6 hours)|Participant-level Detection Rate (DR), Percentage of participants with a positive Day 0 or Day 1 scan out of all participants with a Day 0 or Day 1 scan., Day 0 (1-4 hours) and Day 1 (24 +/- 6 hours)|Participant-level False Positive Rate (FPR), Percentage of false positive (FP) participants on the Day 0 or Day 1 scan out of all participants with a positive Day 0 or Day 1 scan., Day 0 (1-4 hours) and Day 1 (24 +/- 6 hours)|Region-level FPR, Percentage of FP regions on the Day 0 or Day 1 scan out of all positive regions on the Day 0 or Day 1 scan., Day 0 (1-4 hours) and Day 1 (24 +/-6 hours)|Participant-level Discrepant PET Negativity Rate, Percentage of participants with contradicting Day 0 and Day 1 results for whom the Reference Standard was positive., Day 0 (1-4 hours) and Day 1 (24 +/-6 hours)|Participant-level True Negative Rate (TNR), Percentage of TN participants on the Day 0 or Day 1 scan out of all participants with a negative Day 0 or Day 1 scan., Day 0 (1-4 hours) and Day 1 (24 +/-6 hours)|Region-level TNR, Percentage of TN regions on the Day 0 or Day 1 scan out of all negative regions on the Day 0 or Day 1 scan., Day 0 (1-4 hours) and Day 1 (24 +/- 6 hours)",,Clarity Pharmaceuticals Ltd,,MALE,"ADULT, OLDER_ADULT",PHASE1|PHASE2,52,INDUSTRY,INTERVENTIONAL,Allocation: NA|Intervention Model: SINGLE_GROUP|Masking: NONE|Primary Purpose: DIAGNOSTIC,CLP06,4/11/2022,8/8/2023,8/8/2023,2/21/2022,10/1/2024,10/1/2024,"Tower Urology, Los Angeles, California, 90048, United States|GU Research Network, Omaha, Nebraska, 68130, United States|New Mexico Cancer Center, Albuquerque, New Mexico, 87109, United States|Carolina Urologic Research Center, Myrtle Beach, South Carolina, 29572, United States|Urology San Antonio, San Antonio, Texas, 78258, United States",https://cdn.clinicaltrials.gov/large-docs/27/NCT05249127/Prot_000.pdf,,,,
