NCT Number,Study Title,Study URL,Acronym,Study Status,Brief Summary,Study Results,Conditions,Interventions,Primary Outcome Measures,Secondary Outcome Measures,Other Outcome Measures,Sponsor,Collaborators,Sex,Age,Phases,Enrollment,Funder Type,Study Type,Study Design,Other IDs,Start Date,Primary Completion Date,Completion Date,First Posted,Results First Posted,Last Update Posted,Locations,Study Documents,,,,
NCT04672460,A Bioequivalence Study Between the Proposed and Current Talazoparib Capsule Formulation and Food Effect Study for the Proposed Talazoparib Capsule Formulation in Participants With Advanced Solid Tumors,https://clinicaltrials.gov/study/NCT04672460,,COMPLETED,"This will be a Phase 1, open label, 2-sequence, crossover study to establish the BE of the current commercial formulation (Generation 3.1 talazoparib capsules) to the proposed talazoparib liquid-filled soft gelatin capsule (soft gel capsule) formulation after multiple dosing under fasting conditions in participants with advanced solid tumors. In addition, the effect of food on the PK of the proposed talazoparib soft gel capsule formulation will be evaluated in fixed sequence after the 2 BE assessment periods.",YES,Advanced Solid Tumors|Solid Tumors|Ovarian Cancer|Breast Cancer|Prostate Cancer|NSCLC|Pancreatic Cancer|Colorectal Cancer,DRUG: TALZENNA capsule|DRUG: Talazoparib soft gel capsule|DRUG: Talazoparib soft gel capsule,"Area Under the Plasma Concentration-Time Profile From Time 0 to 24 Hours (AUC24) of Talazoparib After Multiple Dosing Under Fasted Conditions, AUC24 was defined as area under the plasma concentration-time profile from time zero to 24 hours post dose. The geometric coefficient of variation is expressed in percentage. The ratio (Test/Reference) of adjusted means and 90% CI were expressed as percentages., Serial blood sample (4 mL) each was collected at predose on Day 27 of Period 1 and Day 20 of Periods 2 and predose and 0.5, 0.75, 1, 1.5, 2, 4, 6, 8, and 24 hours postdose on Day 28 of Period 1 and Day 21 of Period 2 to 3, respectively.|Maximum Observed Plasma Concentration (Cmax) of Talazoparib After Multiple Dosing Under Fasted Conditions, Cmax was the maximum observed plasma concentration and was directly observed from data. The geometric coefficient of variation was expressed in percentage. The ratio (Test/Reference) of adjusted means and 90% CI were expressed as percentages., Serial blood sample (4 mL) each was collected at predose on Day 27 of Period 1 and Day 20 of Periods 2 and predose and 0.5, 0.75, 1, 1.5, 2, 4, 6, 8, and 24 hours postdose on Day 28 of Period 1 and Day 21 of Period 2 to 3, respectively.|Area Under the Plasma Concentration-Time Profile From Time 0 to 24 Hours (AUC24) of Talazoparib After Multiple Dosing Under Fed Conditions, AUC24 was defined as area under the plasma concentration-time profile from time zero to 24 hours post dose. The geometric coefficient of variation is expressed in percentage. The ratio (Test/Reference) of adjusted means and 90% CI were expressed as percentages., Serial blood sample (4 mL) each was collected at predose on Day 27 of Period 1 and Day 20 of Periods 2 and predose and 0.5, 0.75, 1, 1.5, 2, 4, 6, 8, and 24 hours postdose on Day 28 of Period 1 and Day 21 of Period 2 to 3, respectively.|Maximum Observed Plasma Concentration (Cmax) of Talazoparib After Multiple Dosing Under Fed Conditions, Cmax was the maximum observed plasma concentration and was directly observed from data. The geometric coefficient of variation was expressed in percentage. The ratio (Test/Reference) of adjusted means and 90% CI were expressed as percentages., Serial blood sample (4 mL) each was collected at predose on Day 27 of Period 1 and Day 20 of Periods 2 and predose and 0.5, 0.75, 1, 1.5, 2, 4, 6, 8, and 24 hours postdose on Day 28 of Period 1 and Day 21 of Period 2 to 3, respectively.","Apparent Clearance After Oral Dose (CL/F) of Talazoparib After Multiple Dosing, Apparent Clearance After Oral Dose (CL/F) was defined as apparent clearance after oral dose on the last day of treatment period. The geometric coefficient of variation is expressed in percentage., Serial blood sample (4 mL) each was collected at predose on Day 27 of Period 1 and Day 20 of Periods 2 and predose and 0.5, 0.75, 1, 1.5, 2, 4, 6, 8, and 24 hours postdose on Day 28 of Period 1 and Day 21 of Period 2 to 3, respectively.|Time of Observed Maximum Plasma Concentration (Tmax) of Talazoparib After Multiple Dosing, Tmax was defined as time to reach maximum observed plasma concentration., Serial blood sample (4 mL) each was collected at predose on Day 27 of Period 1 and Day 20 of Periods 2 and predose and 0.5, 0.75, 1, 1.5, 2, 4, 6, 8, and 24 hours postdose on Day 28 of Period 1 and Day 21 of Period 2 to 3, respectively.|Area Under the Plasma Concentration-Time Profile From Time 0 to Time of the Last Quantifiable Concentration (AUClast) of Talazoparib After Multiple Dosing, AUClast was area under the plasma concentration time-curve from zero (pre-dose) to the last measured concentration. The geometric coefficient of variation was expressed in percentage., Serial blood sample (4 mL) each was collected at predose on Day 27 of Period 1 and Day 20 of Periods 2 and predose and 0.5, 0.75, 1, 1.5, 2, 4, 6, 8, and 24 hours postdose on Day 28 of Period 1 and Day 21 of Period 2 to 3, respectively.|Predose Concentration During Multiple Dosing (Ctrough) of Talazoparib After Multiple Dosing, Ctrough was the pre-dose concentration during multiple dosing and was directly observed from data. The geometric coefficient of variation is expressed in percentage., Serial blood sample (4 mL) each was collected at predose on Day 27 of Period 1 and Day 20 of Periods 2, predose and 0.5, 0.75, 1, 1.5, 2, 4, 6, 8, and 24 hours postdose on Day 28 of Period 1 and Day 21 of Period 2 to 3, respectively.|Number of Participants With Treatment-Emergent Adverse Events (TEAEs) (All Causalities), An AE was any untoward medical occurrence in a participant who received study drug without regard to possibility of causal relationship. Grade 3: severe or medically significant but not immediately life-threatening, hospitalization or prolongation of existing hospitalization indicated, disabling, limiting self-care ADL; Grade 4: life-threatening consequence, urgent intervention indicated; Grade 5: death related to AE. Treatment-emergent adverse event (TEAE) means event between first dose of study treatment and up to 28 days after last dose that were absent before treatment or that worsened relative to pretreatment state. An SAE was an AE resulting in any of death; inpatient hospitalization; life-threatening experience; disability; congenital anomaly or deemed significant for any other reason., Day 1 up to 28 days after last dose of study drug (maximum up to 388 days)|Number of Participants With Treatment-Emergent Adverse Events (TEAEs) (Treatment Related), An AE was any untoward medical occurrence in a participant who received study drug without regard to possibility of causal relationship. Grade 3: severe or medically significant but not immediately life-threatening, hospitalization or prolongation of existing hospitalization indicated, disabling, limiting self-care ADL; Grade 4: life-threatening consequence, urgent intervention indicated; Grade 5: death related to AE. Treatment-emergent adverse event (TEAE) means event between first dose of study treatment and up to 28 days after last dose that were absent before treatment or that worsened relative to pretreatment state. An SAE was an AE resulting in any of death; inpatient hospitalization; life-threatening experience; disability; congenital anomaly or deemed significant for any other reason., Day 1 up to 28 days after last dose of study drug (maximum up to 388 days)",,Pfizer,,ALL,"ADULT, OLDER_ADULT",PHASE1,73,INDUSTRY,INTERVENTIONAL,Allocation: RANDOMIZED|Intervention Model: CROSSOVER|Masking: NONE|Primary Purpose: TREATMENT,C3441037|2020-006101-35,12/21/2020,2/4/2022,7/22/2022,12/17/2020,9/25/2024,9/25/2024,"California Cancer Associates for Research and Excellence, Inc (cCARE), Encinitas, California, 92024, United States|Cedars-Sinai Medical Center, Samuel Oschin Comprehensive Cancer Institute, Los Angeles, California, 90048, United States|Cedars-Sinai Medical Center, Los Angeles, California, 90048, United States|California Cancer Associates for Research and Excellence, Inc (cCARE), San Marcos, California, 92069, United States|Smilow Cancer Hospital at Yale New Haven, New Haven, Connecticut, 06510, United States|Yale-New Haven Hospital, New Haven, Connecticut, 06510, United States|Smilow Cancer Hospital Phase 1 Unit, New Haven, Connecticut, 06511, United States|Florida Cancer Specialists, Lake Mary, Florida, 32746, United States|Alliance for Multispecialty Research, LLC, Kansas City, Missouri, 64114, United States|Montefiore Medical Center, Bronx, New York, 10461, United States|NYU Langone Hospital - Long Island Oncology, Mineola, New York, 11501, United States|NYU Langone Hospital - Long Island, Mineola, New York, 11501, United States|Laura & Isaac Perlmutter Cancer Center at NYU Langone Health, New York, New York, 10016, United States|NYU Investigational Pharmacy, New York, New York, 10016, United States|NYU Langone Medical Center (Tisch Hospital), New York, New York, 10016, United States|University of Cincinnati Medical Center, Cincinnati, Ohio, 45219, United States|University Hospitals Cleveland Medical Center, Cleveland, Ohio, 44106, United States|West Chester Hospital, West Chester, Ohio, 45069, United States|UPCI Investigational Drug Service, Pittsburgh, Pennsylvania, 15232, United States|UPMC Hillman Cancer Center, Pittsburgh, Pennsylvania, 15232, United States|Upmc Shadyside, Pittsburgh, Pennsylvania, 15232, United States|Mary Crowley Cancer Research - Medical City Hospital, Dallas, Texas, 75230, United States|NEXT Oncology, San Antonio, Texas, 78229, United States|Liverpool Cancer Therapy Centre, Liverpool, New South Wales, 2170, Australia|Liverpool Hospital, Liverpool, New South Wales, 2170, Australia|Monash Health, Clayton, Victoria, 3168, Australia|Epworth Healthcare (Epworth Freemasons Hospital), East Melbourne, Victoria, 3002, Australia|Epworth Healthcare, East Melbourne, Victoria, 3002, Australia|Epworth Healthcare, Richmond, Victoria, 3121, Australia|Epworth Richmond Hospital (Epworth Healthcare), Richmond, Victoria, 3121, Australia|Epworth Healthcare, East Melbourne, 3002, Australia","Study Protocol, https://cdn.clinicaltrials.gov/large-docs/60/NCT04672460/Prot_000.pdf","Statistical Analysis Plan, https://cdn.clinicaltrials.gov/large-docs/60/NCT04672460/SAP_001.pdf",,,
NCT01794793,Study to Allow Access to Pasireotide for Patients Benefiting From Pasireotide Treatment in Novartis-sponsored Studies,https://clinicaltrials.gov/study/NCT01794793,,COMPLETED,The purpose of this study is to allow continued use of pasireotide in patients who are on pasireotide treatment in a Novartis-sponsored study and are benefiting from the treatment as judged by the investigator.,YES,Cushing's Disease|Acromegaly|Neuroendocrine Tumors|Pituitary Tumors|Ectopic ACTH Secreting (EAS) Tumors|Dumping Syndrome|Prostate Cancer|Melanoma Negative for bRAF|Melanoma Negative for nRAS,DRUG: Pasireotide|DRUG: Cabergoline|DRUG: Pasireotide LAR,"Incidence of Adverse Events to Evaluate Long Term Safety Data, Collect long term safety data, i.e. SAEs and AEs. SAES will be reviewed and reported as part of the regular pharmacovigilance activities., Baseline up to approximately 10 years","Percentage of Patients With Clinical Benefit as Assessed by the Investigator, Efficacy was assessed by the investigator at each scheduled visit using a binary (yes/no) response confirming the investigator's judgement of clinical benefit (via the question: ""Does investigator confirm that the subject continues to have clinical benefit from the study treatment""). No other measures of efficacy were used in this study., Baseline up to approximately 10 years",,RECORDATI GROUP,,ALL,"ADULT, OLDER_ADULT",PHASE4,337,INDUSTRY,INTERVENTIONAL,Allocation: NON_RANDOMIZED|Intervention Model: PARALLEL|Masking: NONE|Primary Purpose: TREATMENT,CSOM230B2412,6/10/2013,7/25/2023,7/25/2023,2/20/2013,8/28/2024,10/1/2024,"Ximed Research SC - SOM230B2412, La Jolla, California, 92037, United States|Cedars Sinai Medical Center Cedars Sinai 4, Los Angeles, California, 90048, United States|Stanford Universtiy Medical Center Stanford Hospital & Clinics, Stanford, California, 94304, United States|University of Michigan Comprehensive Cancer Center SC-2, Ann Arbor, Michigan, 48109, United States|Memorial Sloan-Kettering Cancer Center SC, New York, New York, 10065, United States|Virginia Endocrinology Research SC, Chesapeake, Virginia, 23321, United States|Swedish Cancer Institute Swedish Cancer Institute (SC), Seattle, Washington, 98104, United States|Recordati Investigative Site, Caba, Buenos Aires, C1405BCH, Argentina|Recordati Investigative Site, Mar del Plata, Buenos Aires, B7602CBM, Argentina|Recordati Investigative Site, Edegem, Antwerpen, 2650, Belgium|Recordati Investigative Site, Brugge, 8310, Belgium|Recordati Investigative Site, Brussel, 1090, Belgium|Recordati Investigative Site, Bruxelles, 1200, Belgium|Recordati Investigative Site, Gent, 9000, Belgium|Recordati Investigative Site, Leuven, 3000, Belgium|Recordati Investigative Site, Liege, 4000, Belgium|Recordati Investigative Site, Wilrijk, 2610, Belgium|Recordati Investigative Site, Fortaleza, CE, 60430 370, Brazil|Recordati Investigative Site, Curitiba, PR, 80030-110, Brazil|Recordati Investigative Site, Rio de Janeiro, RJ, 21941-913, Brazil|Recordati Investigative Site, Porto Alegre, RS, 90560 030, Brazil|Recordati Investigative Site, Joinville, SC, 89201260, Brazil|Recordati Investigative Site, Botucatu, SP, 18618-970, Brazil|Recordati Investigative Site, Sao Paulo, SP, 05403 000, Brazil|Recordati Investigative Site, Sofia, 1431, Bulgaria|Recordati Investigative Site, Halifax, Nova Scotia, B3H 1V7, Canada|Recordati Investigative Site, London, Ontario, N6A 4L6, Canada|Recordati Investigative Site, Montreal, Quebec, H2L 4M1, Canada|Recordati Investigative Site, Montreal, Quebec, H2W 1T8, Canada|Recordati Investigative Site, Toulouse, Cedex 9, 31000, France|Recordati Investigative Site, Angers cedex 09, 49933, France|Recordati Investigative Site, Bron Cedex, 69677, France|Recordati Investigative Site, Le Kremlin Bicetre, 94275, France|Recordati Investigative Site, Lille Cedex, 59037, France|Recordati Investigative Site, Marseille cedex 05, 13385, France|Recordati Investigative Site, Pessac Cedex, 33604, France|Recordati Investigative Site, Pierre Benite Cedex, 69495, France|Recordati Investigative Site, Berlin, 13353, Germany|Recordati Investigative Site, Hamburg, 20246, Germany|Recordati Investigative Site, Muenchen, 81377, Germany|Recordati Investigative Site, Muenchen, 81667, Germany|Recordati Investigative Site, Tübingen, 72076, Germany|Recordati Investigative Site, Ulm, 89081, Germany|Recordati Investigative Site, Wuerzburg, 97080, Germany|Recordati Investigative Site, Athens, GR, 115 27, Greece|Recordati Investigative Site, Budapest, 1085, Hungary|Recordati Investigative Site, Bangalore, Karnataka, 560054, India|Recordati Investigative Site, Vellore, Tamil Nadu, 632004, India|Recordati Investigative Site, Petach Tikva, 49100, Israel|Recordati Investigative Site, Ancona, AN, 60126, Italy|Recordati Investigative Site, Genova, GE, 16132, Italy|Milano Investigative Site, Milano, MI, 20149, Italy|Recordati Investigative Site, Padova, PD, 35128, Italy|Recordati Investigative Site, Roma, RM, 00168, Italy|Recordati Investigative Site, Nagoya, Aichi, 460-0001, Japan|Recordati Investigative Site, Maebashi city, Gunma, 371 8511, Japan|Recordati Investigative Site, Kobe-shi, Hyogo, 650-0017, Japan|Recordati Investigative Site, Nankoku city, Kochi, 783 8505, Japan|Recordati Investigative Site, Kyoto-city, Kyoto, 612-8555, Japan|Recordati Investigative Site, Suita city, Osaka, 565 0871, Japan|Recordati Investigative Site, Seoul, 03722, Korea, Republic of|Recordati Investigative Site, Seoul, 06351, Korea, Republic of|Recordati Investigative Site, Kuala Lumpur, 62502, Malaysia|Recordati Investigative Site, Pulau Pinang, 10990, Malaysia|Recordati Investigative Site, México, Distrito Federal, 14269, Mexico|Recordati Investigative Site, Guadalajara, Jalisco, 44130, Mexico|Recordati Investigative Site, Durango, 34270, Mexico|Recordati Investigative Site, Mexico City, 07760, Mexico|Recordati Investigative Site, Groningen, 9713 GZ, Netherlands|Recordati Investigative Site, San Isidro, Lima, 27, Peru|Recordati Investigative Site, Gdansk, 80 952, Poland|Recordati Investigative Site, Poznan, 60-355, Poland|Recordati Investigative Site, Warszawa, 04141, Poland|Recordati Investigative Site, Wroclaw, 50 367, Poland|Recordati Investigative Site, Porto, 4200-319, Portugal|Recordati Investigative Site, Bucuresti, 011863, Romania|Recordati Investigative Site, Barnaul, 656024, Russian Federation|Recordati Investigative Site, Moscow, 123317, Russian Federation|Recordati Investigative Site, Saint Petersburg, 197341, Russian Federation|Recordati Investigative Site, Tyumen, 625023, Russian Federation|Recordati Investigative Site, Alicante, Comunidad Valenciana, 03010, Spain|Recordati Investigative Site, Barcelona, 08041, Spain|Recordati Investigative Site, Lausanne, 1011, Switzerland|Recordati Investigative Site, Zuerich, 8091, Switzerland|Recordati Investigative Site, Taichung, 40705, Taiwan|Recordati Investigative Site, Bangkok, 10400, Thailand|Recordati Investigative Site, Bangkok, 10700, Thailand|Recordati Investigative Site, Songkla, 90110, Thailand|Recordati Investigative Site, Istanbul, TUR, 34098, Turkey|Recordati Investigative Site, Ankara, 06500, Turkey|Recordati Investigative Site, Antalya, 07070, Turkey|Recordati Investigative Site, Istanbul, 34890, Turkey|Recordati Investigative Site, Izmir, 35340, Turkey|Recordati Investigative Site, Kocaeli, 41380, Turkey","Study Protocol, https://cdn.clinicaltrials.gov/large-docs/93/NCT01794793/Prot_000.pdf","Statistical Analysis Plan, https://cdn.clinicaltrials.gov/large-docs/93/NCT01794793/SAP_001.pdf","Informed Consent Form, https://cdn.clinicaltrials.gov/large-docs/93/NCT01794793/ICF_002.pdf",,
NCT04902144,Clinical Outcomes for Offering Genetic Testing in a Tiered Approach,https://clinicaltrials.gov/study/NCT04902144,,COMPLETED,This clinical quality improvement study reviews and develops a clinical operations workflow to identify cancer patients who meet criteria for genetic counseling and testing. This study may improve utilization of genetic counseling and testing amongst community-based oncology providers caring for cancer patients in a rural and underserved area.,YES,Breast Carcinoma|Colon Carcinoma|Malignant Solid Neoplasm|Ovarian Carcinoma|Pancreatic Carcinoma|Prostate Carcinoma,OTHER: Electronic Health Record Review|OTHER: Questionnaire Administration|BEHAVIORAL: Behavioral Intervention,"Identify Cancer Patients Who Meet Criteria for Genetic Counseling and Testing, The number of cancer patients who meet criteria for genetic counseling and testing as identified by the study team and OMC oncology providers, 6 months|Uptake of Genetic Testing, Number of genetic testing ordered and processed for patients with cancer who meet criteria for testing. Out of 415 patients seen in phase I, 100 met criteria but only 29 received testing. Out of 219 patients seen in phase II, 48 met criteria but only 25 received testing., Up to study completion (Assessed up to1 year and 4 months)|Clinical and Patient Reported Outcomes Following Genetic Test Results, Pertinent clinical information regarding genetic test result and related outcomes (referrals, treatment recommendations); pulled directly from electronic health record, genetic test reports, and patient questionnaires, Up to study completion (Assessed up to 1 year and 4 months)",,,Fred Hutchinson Cancer Center,National Cancer Institute (NCI),ALL,"ADULT, OLDER_ADULT",NA,6,OTHER,INTERVENTIONAL,Allocation: NA|Intervention Model: SINGLE_GROUP|Masking: NONE|Primary Purpose: SCREENING,RG1121550|NCI-2021-04181|STUDY00010137|P30CA015704,8/3/2020,12/31/2021,12/31/2021,5/26/2021,6/9/2023,6/9/2023,"Olympic Medical Cancer Center, Sequim, Washington, 98382, United States","Study Protocol, https://cdn.clinicaltrials.gov/large-docs/44/NCT04902144/Prot_001.pdf","Informed Consent Form, https://cdn.clinicaltrials.gov/large-docs/44/NCT04902144/ICF_002.pdf",,,
NCT04676334,CATCH-R: A Rollover Study to Provide Continued Access to Rucaparib,https://clinicaltrials.gov/study/NCT04676334,CATCH-R,COMPLETED,"This protocol is designed to provide participants currently benefiting from rucaparib treatment in a Clovis-sponsored clinical study with continued access to treatment for as long as they continue to benefit. Participants in long-term follow-up (LTFU) in a parent study may also enroll in this study for continued data collection, as applicable based on parent study objectives.",YES,Metastatic Castration-Resistant Prostate Cancer|Ovarian Cancer|Epithelial Ovarian Cancer|Fallopian Tube Cancer|Peritoneal Cancer|Other Solid Tumor,DRUG: Rucaparib,"Number of Participants Experiencing SAEs and AESIs, An SAE was any untoward medical occurrence that occurred at any dose, or after informed consent was given and prior to dosing if the SAE was related to a study procedure, that: resulted in death; was life-threatening; required in-patient hospitalization or prolongation of existing hospitalization; resulted in persistent or significant disability/incapacity; resulted in a congenital anomaly or birth defect; or was an important medical event that may not have resulted in death, was not life-threatening, or did not require hospitalization but may be considered an SAE, based on appropriate medical judgment. An AESI was defined as any AE of scientific and medical concern specific to the sponsor's product or program, for which ongoing monitoring and rapid communication by the investigator to the sponsor can be appropriate. A summary of all SAEs regardless of causality is located in the 'Reported Adverse Events' Section., From first dose of rucaparib through 28 days after receiving last dose of rucaparib (approximately 20 months)",,,pharmaand GmbH,,ALL,"ADULT, OLDER_ADULT",PHASE3,34,INDUSTRY,INTERVENTIONAL,Allocation: NON_RANDOMIZED|Intervention Model: PARALLEL|Masking: NONE|Primary Purpose: TREATMENT,CO-338-111|2020-001538-37,3/22/2021,3/8/2023,3/8/2023,12/21/2020,5/7/2024,5/7/2024,"London Regional Cancer Centre, London, Ontario, Canada|Institut De Recherche De L'Hospital D'Ottawa, Ottawa, Ontario, Canada|Princess Margaret Hospital - Toronto, Toronto, Ontario, Canada|Centre Hospitalier de L'Universite de Montreal (CHUM), Montréal, Quebec, Canada|CIUSSS de l'Estrie - CHUS, Sherbrooke, Quebec, Canada|Carmel Medical Center, Haifa, Israel|Meir Medical Center, Kfar Saba, Israel|Istituto per la Ricerca e la Cura del Cancro Istituto di Candiolo, Candiolo, Torino, Italy|Azienda Ospedaliero-Universitaria di Bologna - Policlinico S.Orsola-Malpighi, Bologna, Italy|Istituto Europeo di Oncologia, Milano, Italy|Istituto Nazionale per lo studio e la cura dei tumori ""Fondazione Pascale"" Oncologia Medica, Napoli, Italy|Fondazione Policlinico Universitario Agostino Gemelli, Roma, Italy|Białostockie Centrum Onkologii im. Marii Skłodowskiej-Curie, Białystok, Podlaskie, Poland|Wojewódzki Szpital Specjalistyczny w Olsztynie, Olsztyn, Warminsko-Mazurskie, Poland|Republic Clinical Oncology Dispensary of the Ministry of Healthcare of Republic of Bashkortostan, Ufa, Bashkortosta, Russian Federation|State Healthcare Institution Oncologic Dispensary No. 2 - Health Department of Krasnodar Region, Sochi, Krasnodar, Russian Federation|Republican oncological dispensary of Republic of Mordovia, Saransk, Mordovia, Russian Federation|Arkhangelsk Clinical Oncological Dispensary, Arkhangel'sk, Primorskiy, Russian Federation|Pyatigorsk Oncological Dispensary, Pyatigorsk, Stavropol, Russian Federation|N.N. Blokhin Russian Cancer Research Center, Moscow, Russian Federation|Omsk Regional Clinical Oncologic Dispensary, Omsk, Russian Federation|Ryazan Regional Clinical Oncology Dispensary, Ryazan', Russian Federation|Almazov National Medical Research Centre, Saint Petersburg, Russian Federation|University College London Hospitals, London, England, United Kingdom|East and North Hertfordshire NHS Trust, Middlesex, England, United Kingdom","Study Protocol, https://cdn.clinicaltrials.gov/large-docs/34/NCT04676334/Prot_001.pdf",,,,
